<?xml version="1.0" encoding="utf-8"?>
<worldGeneration version="2"
				 xmlns="http://warpdrive.lemadec.org"
				 xmlns:xsi="http://www.w3.org/2001/XMLSchema-instance"
				 xsi:schemaLocation="http://warpdrive.lemadec.org WarpDrive.xsd">
	
	<schematic group="ship" name="legacy" filename="legacy" weight="1">
		<replacement block="minecraft:stone" metadata="0">
			<import group="hull_plain" name="%hull1%" />
		</replacement>
		<replacement block="minecraft:glass" metadata="0">
			<import group="hull_glass" name="%hull1%" />
		</replacement>
		<replacement block="minecraft:sandstone" metadata="0">
			<import group="hull_plain" name="%hull2%" />
		</replacement>
		<replacement block="minecraft:stained_glass" metadata="0">
			<import group="hull_glass" name="%hull2%" />
		</replacement>
		<replacement block="minecraft:wool" metadata="0">
			<for variable="colorMetadata" in="0,1,2,3,4,5,6,8">
				<filler block="minecraft:wool" metadata="%colorMetadata%" weight="1" />
			</for>
		</replacement>
		<replacement block="minecraft:wool" metadata="14">
			<for variable="colorMetadata" in="7,9,10,11,12,13,14,15,16">
				<filler block="minecraft:wool" metadata="%colorMetadata%" weight="1" />
			</for>
		</replacement>
		<replacement block="ComputerCraft:CC-Computer">
			<filler block="ComputerCraft:CC-Computer" weight="1" mods="ComputerCraft" />
			<filler block="minecraft:air" ratio="0.5" />
		</replacement>
	</schematic>
	
	<schematic group="ship" name="legacy" filename="legacy_corrupted" weight="1">
		<replacement block="minecraft:stone" metadata="0">
			<import group="hull_plain" name="%hull1%" />
			<filler block="minecraft:air" ratio="0.1" />
			<filler block="WarpDrive:blockShipCorruption" ratio="0.0025" />
		</replacement>
		<replacement block="minecraft:glass" metadata="0">
			<import group="hull_glass" name="%hull1%" />
			<filler block="minecraft:air" ratio="0.2" />
		</replacement>
		<replacement block="minecraft:sandstone" metadata="0">
			<import group="hull_plain" name="%hull2%" />
			<filler block="minecraft:air" ratio="0.1" />
			<filler block="WarpDrive:blockShipCorruption" ratio="0.0025" />
		</replacement>
		<replacement block="minecraft:stained_glass" metadata="0">
			<import group="hull_glass" name="%hull2%" />
			<filler block="minecraft:air" ratio="0.2" />
		</replacement>
		<replacement block="minecraft:stone" metadata="0">
			<import group="cable" />
			<filler block="minecraft:air" ratio="0.25" />
		</replacement>
		<replacement block="minecraft:glass" metadata="0">
			<import group="solar" />
			<filler block="minecraft:air" ratio="0.25" />
		</replacement>
		<replacement block="minecraft:wool" metadata="0">
			<for variable="colorMetadata" in="0,1,2,3,4,5,6,8">
				<filler block="minecraft:wool" metadata="%colorMetadata%" weight="1" />
			</for>
		</replacement>
		<replacement block="minecraft:wool" metadata="14">
			<for variable="colorMetadata" in="7,9,10,11,12,13,14,15,16">
				<filler block="minecraft:wool" metadata="%colorMetadata%" weight="1" />
			</for>
		</replacement>
		<replacement block="warpdrive:blockShipCore">
			<filler block="warpdrive:blockShipCore" weight="1" />
			<filler block="minecraft:air" ratio="0.5" />
		</replacement>
		<replacement block="warpdrive:blockAirGenerator">
			<filler block="warpdrive:blockAirGenerator" weight="1" />
			<filler block="minecraft:air" ratio="0.5" />
		</replacement>
		<replacement block="warpdrive:blockShipController">
			<filler block="warpdrive:blockShipController" weight="1" />
			<filler block="minecraft:air" ratio="0.5" />
		</replacement>
		<replacement block="ComputerCraft:CC-Computer">
			<filler block="ComputerCraft:CC-Computer" weight="1" mods="ComputerCraft" />
			<filler block="minecraft:air" ratio="0.5" />
		</replacement>
	</schematic>
	
	<structure group="ship" name="legacy" ratio="0.2">
	</structure>
	
</worldGeneration>
